{
	"someEventString": "someValue",
	"someEventInteger": 1,
	"someEventStringArray": [
		"someEventValue1", "someEventValue2", "someEventValue3", "someEventValue4"
	],
	"someEventIntegerArray": [
		1, 2, 3, 4, 5, 6, 7, 8, 9
	],
	"simpleEventObject": {
		"stringEventProperty": "someEventValue",
		"integerEventProperty": 1
	},
	"arrayOfEventObjects": [
		{
			"stringEventProperty": "someEventValue1",
			"integerEventProperty": 1
		},
		{
			"stringEventProperty": "someEventValue2",
			"integerEventProperty": 2
		},
		{
			"stringEventProperty": "someEventValue3",
			"integerEventProperty": 3
		}
	],
	"complexEventObject": {
		"objectEventProperty": {
			"stringEventProperty": "someEventValue",
			"integerEventProperty": 1
		},
		"arrayEventProperty": [
			{
				"stringEventProperty": "someEventValue1",
				"integerEventProperty": 1
			},
			{
				"stringEventProperty": "someEventValue2",
				"integerEventProperty": 2
			},
			{
				"stringEventProperty": "someEventValue3",
				"integerEventProperty": 3
			}
		]
	}
}